{
  "schema_version": "1.0.0",
  "definition": {
    "id": "lung-regional-contract-v1",
    "version": "1.0.0",
    "title": "Regional pulmonary surrogate for contract verification"
  },
  "variant": "regional_circulation",
  "component": {
    "name": "organ.lung",
    "model_id": "lung.regional.contract.v1",
    "entry_port_id": "pulmonary-arterial-entry",
    "exit_port_id": "pulmonary-venous-exit",
    "return_target_model_id": "synthetic-branching-circuit",
    "return_target_port_id": "pulmonary-venous-return"
  },
  "timing": {
    "regions": [
      {"id": "pulmonary-artery", "transit_time_s": 0.5},
      {"id": "regional-capillary-surrogate", "transit_time_s": 1.0},
      {"id": "pulmonary-vein", "transit_time_s": 0.5}
    ]
  },
  "validity": {
    "population": "software contract tests only",
    "physiological_state": "not applicable",
    "evidence_class": "software_test_surrogate",
    "description": "Three serial regions with deterministic durations selected solely to verify interchangeable composition."
  },
  "sources": [
    {
      "id": "mehlissa-m3-contract",
      "citation": "MEHLISSA Next M3 body-organ coupling contract tests, version 1.0.0",
      "url": "https://github.com/RegineWendt/MEHLISSA",
      "license": "CC-BY-4.0",
      "role": "software verification scenario"
    }
  ],
  "limitations": [
    "All regional durations are test values and are not physiological evidence.",
    "Region labels are structural and do not identify imported anatomical vessels.",
    "The model has no pressure, resistance, branching, uncertainty, or gas exchange."
  ]
}
