{
  "schema_version": "1.0.0",
  "definition": {
    "id": "lung-compartment-contract-v1",
    "version": "1.0.0",
    "title": "Effective lung compartment for contract verification"
  },
  "variant": "effective_compartment",
  "component": {
    "name": "organ.lung",
    "model_id": "lung.compartment.contract.v1",
    "entry_port_id": "pulmonary-arterial-entry",
    "exit_port_id": "pulmonary-venous-exit",
    "return_target_model_id": "synthetic-branching-circuit",
    "return_target_port_id": "pulmonary-venous-return"
  },
  "timing": {
    "transit_time_s": 2.0
  },
  "validity": {
    "population": "software contract tests only",
    "physiological_state": "not applicable",
    "evidence_class": "software_test_surrogate",
    "description": "Deterministic two-second transit selected solely to verify component contracts."
  },
  "sources": [
    {
      "id": "mehlissa-m3-contract",
      "citation": "MEHLISSA Next M3 body-organ coupling contract tests, version 1.0.0",
      "url": "https://github.com/RegineWendt/MEHLISSA",
      "license": "CC-BY-4.0",
      "role": "software verification scenario"
    }
  ],
  "limitations": [
    "The two-second transit is a test value and is not physiological evidence.",
    "The model has no anatomy, pressure, resistance, perfusion distribution, uncertainty, or gas exchange."
  ]
}
